{
  "resume_packet_id": "R-SAVE-001-01",
  "task_id": "T-SAVE-001",
  "created_at": "2026-07-13T17:05:00+02:00",
  "receiving_session_id": "session-claude-002",
  "handoff_path": "examples/feature-save-schema/tasks/T-SAVE-001/handoff.yaml",
  "handoff_hash": "sha256:2e7e0d6d25180ab6626f103aeb9943bac0a8fdd6a4e020d23a2d079b21d664d3",
  "source_session_id": "session-codex-001",
  "source_context_lock_path": "examples/feature-save-schema/tasks/T-SAVE-001/source-context.lock.json",
  "source_context_lock_hash": "sha256:30282dd811aa82816a98fd7b5805b848248dcf3e16f6f7e6d70a0aa40727d6f1",
  "receiving_context_lock_path": "examples/feature-save-schema/tasks/T-SAVE-001/receiving-context.lock.json",
  "receiving_context_lock_hash": "sha256:61b8f331ce74bcd01924347f5b748d88994e39ce806b6added0cc63817bf710c",
  "active_context_lock_path": "examples/feature-save-schema/tasks/T-SAVE-001/context.lock.json",
  "objective": "Add schema version serialization and legacy version detection.",
  "next_safe_action": "Implement missing-field parsing as version 0 at the deserialization boundary, then run the focused legacy-save test.",
  "blockers": [],
  "open_questions": [
    "Should schema version parsing live in SaveData or the serializer adapter?"
  ],
  "do_not_repeat": [
    "Do not redesign the external workflow plan during resume.",
    "Do not overwrite the legacy fixture during the test."
  ],
  "worktree_dirty": true,
  "uncommitted_summary": "SaveSystemTests.cs contains the failing legacy-save test.",
  "read_order": [
    "examples/feature-save-schema/task-brief.md",
    "examples/feature-save-schema/project-doc.md",
    "examples/feature-save-schema/tasks/T-SAVE-001/handoff.yaml"
  ],
  "omissions": [
    {
      "candidate": "docs/superpowers/specs/",
      "reason": "The canonical save contract and focused task brief are sufficient for this implementation step.",
      "required": false
    }
  ],
  "bootstrap_instruction": "Validate this packet and its referenced context lock. Read read_order in order, do not load the previous transcript, and begin only with next_safe_action after confirming source hashes.",
  "raw_transcripts_included": false,
  "packet_hash": "sha256:369337c13c41c70a3f3a42706048b16edc72975ab6d7745952aed64eb9ad6ff2"
}
